{
  "id": "L4-entity-security",
  "title": "Public data entity + security privilege/duty/role chain over a table",
  "tier": 4,
  "instruction": "In the sandbox model, expose AslXyzNoteHeader (NoteId, Subject) for OData/DMF integration and lock it behind a proper security chain. Create: (1) a public data entity XyzNoteHeaderEntity (EntityCategory=Master, mapping NoteId/Subject to the table, primary key on NoteId); (2) a display menu item XyzNoteHeaderDisplay pointing at the XyzNoteHeaderList form; (3) a security privilege XyzNoteHeaderMaintain at maintain access level, granting EntryPoints access to the menu item AND DataEntityPermissions access to the data entity; (4) a security duty XyzNoteHeaderDuty grouping the privilege; (5) a security role XyzNoteHeaderRole grouping the duty. Use get_knowledge(topic=\"data entities\") and get_knowledge(topic=\"security\") to ground the patterns, and security_info to sanity-check the chain. All five objects must build clean, and the chain must actually resolve end to end (a non-empty privilege with real entry points/data-entity grants, a non-empty duty, a non-empty role) -- an empty skeleton that merely compiles is not correct.",
  "target_artifact_types": [
    "AxDataEntityView",
    "AxMenuItemDisplay",
    "AxSecurityPrivilege",
    "AxSecurityDuty",
    "AxSecurityRole"
  ],
  "golden_path": "eval/goldens/L4-entity-security/",
  "ignore": [
    "**/@Id",
    "**/ModelSaveInfo"
  ],
  "tags": [
    "data-entity",
    "security",
    "privilege",
    "duty",
    "role",
    "multi-artifact",
    "odata"
  ],
  "split": "holdout"
}
