{
  "id": "L2-interface-abstract-basic",
  "title": "Interface + abstract class + custom-to-custom inheritance",
  "tier": 2,
  "instruction": "In the sandbox model, create: (1) an interface AslIXyzNoteRenderer with one method signature, str render() (X++ interfaces are stored as plain AxClass XML with 'interface' in the Declaration -- an empty-body method entry, not a semicolon-terminated signature); (2) an abstract class XyzNoteRendererBase that implements AslIXyzNoteRenderer, provides a concrete render() returning '[Note] ' + this.renderContent(), and declares an abstract method protected abstract str renderContent() (also an empty-body method entry, per X++ convention -- never a semicolon); (3) a concrete class XyzNotePlainRenderer that extends XyzNoteRendererBase and overrides renderContent() to return 'Plain note content'. This demonstrates custom-to-custom class inheritance (the concrete class extends a CUSTOM abstract base, not a platform base class). All three must build clean.",
  "target_artifact_types": [
    "AxClass",
    "AxClass",
    "AxClass"
  ],
  "golden_path": "eval/goldens/L2-interface-abstract-basic/",
  "ignore": [
    "**/@Id",
    "**/ModelSaveInfo"
  ],
  "tags": [
    "class",
    "interface",
    "abstract",
    "inheritance",
    "multi-artifact",
    "deterministic"
  ],
  "split": "holdout"
}
