{
  "id": "L1-query-view-basic",
  "title": "AxQuery + AxView over AslXyzNoteHeader",
  "tier": 1,
  "instruction": "In the sandbox model, create an AxQuery named XyzNoteHeaderQuery with a single root datasource over the AslXyzNoteHeader table, selecting NoteId and Subject. Then create an AxView named XyzNoteHeaderView built on that query, with two bound fields (NoteId, Subject) referencing the query's root datasource. Both objects must build clean.",
  "target_artifact_types": [
    "AxQuery",
    "AxView"
  ],
  "golden_path": "eval/goldens/L1-query-view-basic/",
  "ignore": [
    "**/@Id",
    "**/ModelSaveInfo"
  ],
  "tags": [
    "query",
    "view",
    "multi-artifact",
    "foundational"
  ],
  "split": "holdout"
}
